{
    "secrets": {
        "key": "valuesecret"
    },
    "connectors": [
        {
            "id":"1",
            "collection": "user_activity",
            "type": "source",
            "resource": "mypg",
            "config": {
                "logical_replication": true
            }
        },
        {
            "id":"2",
            "collection": "user_activity_enriched",
            "type": "destination",
            "resource": "mypg"
        }
    ],
    "functions": [
        {
            "id":"3",
            "name": "user_activity_enriched",
            "image": "ftorres/enrich:9",
            "env_vars": {
                "CLEARBIT_API_KEY": "token-1"
            }
        }
    ],
    "streams":[
        {
            "id": "12345",
            "name": "my_stream1",
            "from_id":"1",
            "to_id":"2"
        },
        {
            "id": "123456",
            "name": "my_stream2",
            "from_id":"2",
            "to_id":"3"
        }
    ],
    "definition": {
        "git_sha": "3630e05a-98b7-43a0-aeb0-c9b5b0d4261c",
        "metadata": {
            "turbine": {
                "language": "golang",
                "version": "0.1.0"
            },
            "spec_version": "0.2.0"
        }
    }
}
